{
  "id": "fleet.mixed",
  "version": "1.0.0",
  "engine_requirement": "^0.12",
  "selectors": {
    "fleet.mixed.sources": "rustd/**/*.rs"
  },
  "capabilities": [],
  "questions": [
    {
      "primitive": {
        "kind": "choice"
      },
      "id": "fleet.mixed.layout",
      "version": "1.0.0",
      "builder": "fleet.mixed.sources",
      "builder_version": "1.0.0",
      "model_version": "recorded-fixture",
      "candidates": [
        "focused",
        "broad"
      ],
      "rule_section": "PROJECT_RULES.md#layout"
    }
  ],
  "policy": {
    "version": 1,
    "nodes": [
      {
        "id": "fleet.mixed.review",
        "dependencies": [],
        "required": false,
        "action": {
          "kind": "select",
          "question_id": "fleet.mixed.layout",
          "condition": {
            "primitive": "choice",
            "candidate": "focused",
            "threshold": 0.8
          },
          "on_true": "conform",
          "on_false": "verify.unit"
        }
      }
    ]
  }
}
